{
  "version": 1,
  "backend": "file-json",
  "updated_at": "2026-07-14T18:33:28Z",
  "skills": {
    "elite-devops-engineer": {
      "category": "devops engineer",
      "history": [
        {
          "skill": "elite-devops-engineer",
          "cycle": 1,
          "timestamp": "2026-07-07T17:44:16Z",
          "dimension": "currency",
          "score_before": 89,
          "score_after": 92,
          "delta": 3,
          "scores_before": {
            "clarity": 18,
            "actionability": 18,
            "currency": 17,
            "coverage": 18,
            "structure": 18,
            "total": 89,
            "rationale": "A comprehensive, well-organized, and current DevOps/SRE skill with concrete checklists, tool references, and anti-patterns, though its breadth trades off some depth in any single area."
          },
          "scores_after": {
            "clarity": 18,
            "actionability": 19,
            "structure": 18,
            "coverage": 19,
            "currency": 18,
            "total": 92,
            "rationale": "Exceptionally detailed, current, and actionable DevOps skill with concrete frameworks, tool tables, and anti-patterns, only lacking a touch more brevity/consistency to be flawless."
          },
          "status": "improved",
          "action": "currency revision applied",
          "commit": "89681d11326027995517bb619a94a1a7b364059e"
        },
        {
          "skill": "elite-devops-engineer",
          "cycle": 2,
          "timestamp": "2026-07-07T19:32:26Z",
          "dimension": "clarity",
          "score_before": 93,
          "score_after": 92,
          "delta": -1,
          "scores_before": {
            "clarity": 18,
            "actionability": 19,
            "currency": 19,
            "coverage": 19,
            "structure": 18,
            "total": 93,
            "rationale": "Exceptionally thorough, current, and actionable DevOps skill with concrete frameworks, checklists, and up-to-date tooling guidance, though its length and density slightly strain quick scannability."
          },
          "scores_after": {
            "clarity": 18,
            "actionability": 19,
            "currency": 18,
            "coverage": 19,
            "structure": 18,
            "total": 92,
            "rationale": "A thorough, well-organized, currently-informed DevOps/SRE reference with concrete checklists, tool tables, and anti-patterns that make it highly actionable."
          },
          "status": "reverted-regression",
          "action": "attempted clarity improvement; judge scored it lower (93->92), change discarded",
          "commit": null
        },
        {
          "skill": "elite-devops-engineer",
          "cycle": 3,
          "timestamp": "2026-07-14T18:27:16Z",
          "dimension": "currency",
          "score_before": 92,
          "score_after": 95,
          "delta": 3,
          "status": "improved",
          "action": "v1.3.0 research: SLOs-as-Code, AI velocity/error budgets, fail-closed SCA+Scorecard, OTel Collector, IDP DORA, AI governance track, desktop release integrity, Dependabot grouping, trusted publishing",
          "sources": [
            "OpenTelemetry collector pipeline / SLO-as-code industry guidance 2026",
            "Platform engineering adoption (Gartner platform teams by 2026)",
            "OpenSSF Scorecard + SLSA supply chain practices",
            "Field lessons: Steward AI Sprint 0 CI SCA + SBOM/checksums",
            "AI governance as third DevOps career track 2026"
          ]
        }
      ],
      "dimensions_covered": {
        "currency": 2,
        "clarity": 2
      },
      "cumulative_trend": {
        "first_score": 89,
        "latest_score": 95,
        "net_delta": 6,
        "improvements": 2,
        "regressions_reverted": 1,
        "failures": 0
      }
    },
    "elite-software-engineer": {
      "category": "software engineer",
      "history": [
        {
          "skill": "elite-software-engineer",
          "cycle": 1,
          "timestamp": "2026-07-07T17:48:29Z",
          "dimension": "currency",
          "score_before": 88,
          "score_after": 89,
          "delta": 1,
          "scores_before": {
            "clarity": 18,
            "actionability": 17,
            "currency": 17,
            "coverage": 18,
            "structure": 18,
            "total": 88,
            "rationale": "A well-organized, richly detailed synthesis of established engineering wisdom with credible 2025-2026 currency additions, though some sections (e.g., anti-patterns, tech reference) slightly overload the actionable core with reference material."
          },
          "scores_after": {
            "clarity": 18,
            "actionability": 17,
            "currency": 17,
            "coverage": 19,
            "structure": 18,
            "total": 89,
            "rationale": "A comprehensive, well-organized synthesis of software engineering wisdom with concrete decision frameworks, current tooling references, and clear output standards, though some sections lean more philosophical than immediately actionable."
          },
          "status": "improved",
          "action": "currency revision applied",
          "commit": "1612447e7d4074e8e3e9aea8e9863479b3114ea9"
        },
        {
          "skill": "elite-software-engineer",
          "cycle": 2,
          "timestamp": "2026-07-07T19:41:21Z",
          "dimension": "clarity",
          "score_before": 89,
          "score_after": 89,
          "delta": 0,
          "scores_before": {
            "clarity": 18,
            "actionability": 17,
            "currency": 17,
            "coverage": 19,
            "structure": 18,
            "total": 89,
            "rationale": "A comprehensive, well-organized synthesis of established software engineering wisdom with concrete decision frameworks, output standards, and current tooling references, though some sections lean toward reference material rather than directly actionable steps."
          },
          "scores_after": {
            "clarity": 18,
            "actionability": 17,
            "currency": 17,
            "coverage": 19,
            "structure": 18,
            "total": 89,
            "rationale": "A comprehensive, well-organized synthesis of classic engineering wisdom with concrete decision frameworks, processes, and current tooling references, though some sections lean more descriptive than prescriptive."
          },
          "status": "improved",
          "action": "clarity revision applied",
          "commit": "f257c3b8dbf9f5c7ba3d5831a781fb19bab6de98"
        },
        {
          "skill": "elite-software-engineer",
          "cycle": 3,
          "timestamp": "2026-07-14T18:33:28Z",
          "dimension": "currency",
          "score_before": 89,
          "score_after": 94,
          "delta": 4,
          "status": "improved",
          "action": "v1.3.0: agent worktree isolation, read-only MCP default, RAG untrusted input, mutation+adversarial tests, anti-patterns for CI-green agent merges / unbounded diffs / citation-as-proof"
        }
      ],
      "dimensions_covered": {
        "currency": 2,
        "clarity": 2
      },
      "cumulative_trend": {
        "first_score": 88,
        "latest_score": 94,
        "net_delta": 6,
        "improvements": 3,
        "regressions_reverted": 0,
        "failures": 0
      }
    },
    "elite-validation-engineer": {
      "category": "validation engineer",
      "history": [
        {
          "skill": "elite-validation-engineer",
          "cycle": 1,
          "timestamp": "2026-07-07T17:51:55Z",
          "dimension": null,
          "score_before": null,
          "score_after": null,
          "delta": 0,
          "status": "failed",
          "action": "failed after 3 attempts",
          "commit": null
        },
        {
          "skill": "elite-validation-engineer",
          "cycle": 2,
          "timestamp": "2026-07-07T19:45:27Z",
          "dimension": "currency",
          "score_before": 91,
          "score_after": 91,
          "delta": 0,
          "scores_before": {
            "clarity": 18,
            "actionability": 18,
            "currency": 17,
            "coverage": 19,
            "structure": 19,
            "total": 91,
            "rationale": "Comprehensive, well-organized, and actionable testing framework with concrete thresholds, decision tables, and anti-patterns, though a few numeric targets (e.g., mutation score, coverage percentages) are asserted without sourcing."
          },
          "scores_after": {
            "clarity": 18,
            "actionability": 18,
            "currency": 18,
            "coverage": 19,
            "structure": 18,
            "total": 91,
            "rationale": "Exceptionally thorough, well-organized, and current testing skill with concrete frameworks, tool references, and anti-patterns, losing minor points only for being dense enough to require selective application."
          },
          "status": "improved",
          "action": "currency revision applied",
          "commit": "36936ad29dbc77fadf1c689f915f8107f952f251"
        },
        {
          "skill": "elite-validation-engineer",
          "cycle": 3,
          "timestamp": "2026-07-14T18:33:28Z",
          "dimension": "currency",
          "score_before": 91,
          "score_after": 93,
          "delta": 5,
          "status": "improved",
          "action": "v1.1.0: fail-closed SCA, adversarial trust-boundary tests, RAG/LLM validation, mutation>85%, ban permanent CI retries, agent same ladder, flake/AI-test metrics"
        }
      ],
      "dimensions_covered": {
        "currency": 3
      },
      "cumulative_trend": {
        "first_score": 91,
        "latest_score": 93,
        "net_delta": 2,
        "improvements": 2,
        "regressions_reverted": 0,
        "failures": 1
      }
    },
    "elite-viral-marketing-manager": {